{
  "schema_version": 1,
  "updated_at": "2026-10-29",
  "tracking_since": "2026-09-18",
  "items": [
    {
      "id": "pl-20261008-vidu-q4-preview-reference-video",
      "date": "2026-10-08",
      "who": "Vidu",
      "kind": "发布",
      "line": "Vidu Q4 Preview参考生视频支持1至15张图片、0至3段参考音频，生成3至16秒并可同步输出音视频；一致性、口型与情绪表现仍是厂商能力说明，本站未实测。",
      "relation": "做连续角色或商品视频时，参考素材上限和可核的输出规格比宣传词更有用。",
      "evidence": "Vidu官方发布页记录于10月8日；模型名、参考图、音频和时长边界来自官方API参数。",
      "source_name": "Vidu官方Q4产品页与API文档",
      "source_url": "https://platform.vidu.com/docs/api-reference/video-models/vidu-q4-preview/reference-to-video",
      "last_verified": "2026-10-29",
      "status": "verified"
    },
    {
      "id": "pl-20260729-xianyu-ai-services-h1-2026",
      "date": "2026-07-29",
      "who": "闲鱼",
      "kind": "报告",
      "line": "据IT之家转述闲鱼2026上半年数据，平台AI服务订单981.6万单、同比增157%，近500万用户购买；AI技能接单占AI订单45.1%，但未据此证明头像定制最畅销或统一价位。",
      "relation": "平台需求存在不等于某个头像价位一定卖得动，接单前仍要看具体品类、交付和运营。",
      "evidence": "7月29日媒体转述闲鱼披露；128至298元及最火头像说法未获同源支持，故删去。",
      "source_name": "IT之家转述闲鱼2026上半年数据",
      "source_url": "https://www.ithome.com/0/983/021.htm",
      "last_verified": "2026-10-29",
      "status": "verified"
    },
    {
      "id": "pl-20261029-qwen-image21-turbo-weight-license",
      "date": "2026-10-29",
      "who": "Qwen",
      "kind": "核对",
      "line": "Qwen-Image-2.1-Turbo模型卡标8步去噪；此固定权重版本的研究许可限定研究或评估，商业使用需另取许可。",
      "relation": "平台接口条款与下载权重许可是不同入口，不能互相代替。",
      "evidence": "HF固定修订fc13ba1的模型卡及许可证；日期为核对日。",
      "source_name": "Qwen官方HF固定版本模型卡与许可",
      "source_url": "https://huggingface.co/Qwen/Qwen-Image-2.1-Turbo/tree/fc13ba1986fcb905854dc8de2f52eee395f49b5b",
      "last_verified": "2026-10-29",
      "status": "verified"
    },
    {
      "id": "pl-20261009-community-workspace-mcp-v210",
      "date": "2026-10-09",
      "who": "Workspace MCP社区项目",
      "kind": "发布",
      "line": "社区项目Workspace MCP发布v2.1.0，新增Gmail转发草稿与可选GCS附件存储；该版README列120+工具及分层加载。",
      "relation": "维护主体、授权范围与默认暴露工具应分别确认，连接器并非Google自有产品。",
      "evidence": "v2.1.0发布稿与固定提交README的工具分层段。",
      "source_name": "维护者GitHub v2.1.0发布",
      "source_url": "https://github.com/taylorwilsdon/google_workspace_mcp/releases/tag/v2.1.0",
      "last_verified": "2026-10-29",
      "status": "verified"
    },
    {
      "id": "pl-20261029-grok-imagine-mascot-template-check",
      "date": "2026-10-29",
      "who": "Grok Imagine",
      "kind": "核对",
      "line": "核对x.ai的Image2.0页面时，可见Mascot Maker、头像与图像编辑模板；本条只记官方目录，未验证生成效果或各账号权益。",
      "relation": "模板入口、底层模型与账号套餐权益需要分开确认。",
      "evidence": "官方模板目录；日期为本次核对日，不作为首发日。",
      "source_name": "x.ai官方Image2.0页面",
      "source_url": "https://x.ai/news/grok-imagine-image-2",
      "last_verified": "2026-10-29",
      "status": "verified"
    },
    {
      "id": "pl-20261010-elliq-nysofa-extension-report",
      "date": "2026-10-10",
      "who": "NYSOFA／Intuition Robotics",
      "kind": "报道",
      "line": "行业媒体10月10日报道纽约州延续ElliQ合作，文中公司负责人也谈及延续；本条未独立核验合同、预算或健康成效。",
      "relation": "持续合作值得跟进，参与者自报与可重复的健康成效研究需要分开。",
      "evidence": "原始报道首段及公司负责人引述；日期按发布日。",
      "source_name": "Robotics & Automation News原始报道",
      "source_url": "https://roboticsandautomationnews.com/2026/10/10/new-york-extends-ai-companion-program-in-partnership-with-intuition-robotics/105806/",
      "last_verified": "2026-10-29",
      "status": "verified"
    },
    {
      "id": "pl-20261029-mcp-notes-glossary-source-check",
      "date": "2026-10-29",
      "who": "mcp-notes",
      "kind": "核对",
      "line": "mcp-notes固定提交说明其Markdown笔记、语义搜索与wiki链接能力；词表模块静态声明6个操作，包含按别名查词、语义搜索、列出词表并可选按领域过滤。",
      "relation": "别名与领域是词表能力；实际部署仍需兼容的嵌入服务与Qdrant向量库。",
      "evidence": "固定提交94a33a1的README与词表模块静态核对；日期为核对日，未安装、未连接依赖、未实跑。",
      "source_name": "mcp-notes作者仓库固定版本",
      "source_url": "https://github.com/michaelkrauty/mcp-notes/tree/94a33a11dd9b482f4d9289b100f45db9696125a4",
      "last_verified": "2026-10-29",
      "status": "verified"
    },
    {
      "id": "pl-20261029-higgsfield-soul-id-source-check",
      "date": "2026-10-29",
      "who": "Higgsfield Soul ID",
      "kind": "核对",
      "line": "Higgsfield官方指南说明：Soul ID用同一人的20–80张照片训练可复用身份，可用于Soul系列与Seedance Elements；训练后仍可能出现不一致。",
      "relation": "角色一致性有适用范围，单人身份、多人场景和跨工具复用需要分开确认。",
      "evidence": "8月1日官方帮助文档；本条日期为核对日，未上传照片、训练或生成。",
      "source_name": "Higgsfield官方Soul ID指南",
      "source_url": "https://higgsfield.ai/creator-hub/help-center/ai-models/how-do-i-create-and-use-a-soul-id-character",
      "last_verified": "2026-10-29",
      "status": "verified"
    },
    {
      "id": "pl-20261029-the-house-v16-source-check",
      "date": "2026-10-29",
      "who": "the-house",
      "kind": "核对",
      "line": "the-house作者的v16开源说明包含纪念日时间轴与共享相册；相册需另部署存储服务，并配置服务地址和令牌。",
      "relation": "陪伴空间的页面形态与相册数据落点，可以分开作为小屋设计资料。",
      "evidence": "作者固定提交b811274的v16说明及photo-album目录；日期为核对日，未部署或接入。",
      "source_name": "the-house作者v16开源说明固定版本",
      "source_url": "https://github.com/wuliu0012/the-house/tree/b81127471db12b02d63586f4c499cac8db4c59d1",
      "last_verified": "2026-10-29",
      "status": "verified"
    },
    {
      "id": "pl-20261009-netclass-linkeebot-launch",
      "date": "2026-10-09",
      "who": "NetClass／Linkee AI",
      "kind": "发布",
      "line": "NetClass公司公告称，其持股40%的Linkee AI合资公司推出LinkeeBot互动AI智能宠物产品线，首批商业化计划面向部分亚洲市场。",
      "relation": "软件陪伴与实体硬件的使用方式、交付成本和实际能力，各有需要核实的部分。",
      "evidence": "SEC Exhibit 99.1中的公司公告；区域商业化是计划，产品功能未独立实测。",
      "source_name": "NetClass公司公告（SEC Exhibit 99.1）",
      "source_url": "https://www.sec.gov/Archives/edgar/data/1927578/000110465926115060/tm2627126d1_ex99-1.htm",
      "last_verified": "2026-10-29",
      "status": "verified"
    },
    {
      "id": "pl-20261008-kentucky-characterai-reuters-allegations",
      "date": "2026-10-08",
      "who": "肯塔基州／Character.AI",
      "kind": "报道",
      "line": "路透10月8日报道称，肯塔基州总检察长周三提交未删节版诉状，并由其办公室向路透提供；报道所述自伤等内容是州方指控，相关对话的产生情境不明。",
      "relation": "诉讼指控、对话产生条件和产品实际安全能力，需要分别核实。",
      "evidence": "Reuters记者Jeff Horwitz报道；10月8日为报道日，未独立复核10月案卷，不构成法院认定或本站复现。",
      "source_name": "Reuters报道（StreetInsider刊载）",
      "source_url": "https://www.streetinsider.com/Reuters/Character.AI%2Bchatbots%2Bencouraged%2Busers%2Bto%2Bcut%2Band%2Bstarve%2Bthemselves%2C%2BKentucky%2Balleges/27167958.html",
      "last_verified": "2026-10-29",
      "status": "verified"
    },
    {
      "id": "pl-20261008-magnific-one-brand-kit-launch",
      "date": "2026-10-08",
      "who": "Magnific",
      "kind": "发布",
      "line": "Magnific于10月8日发布Magnific One：提示先经过美术方向层再出图；可选Brand Kit可从网站、规范PDF、图片或文字提取品牌要素，在Final模式引导输出。",
      "relation": "这是Magnific自己的Brand Kit，与ElevenLabs同名功能不是同一产品；实际风格一致性尚未独立测试。",
      "evidence": "10月8日公司发布稿与Magnific产品页；发布时面向全球付费计划，功能未实测。",
      "source_name": "Magnific公司发布稿（PR Newswire）",
      "source_url": "https://www.prnewswire.com/news-releases/magnific-one-an-ai-image-model-with-art-direction-built-in-302902528.html",
      "last_verified": "2026-10-29",
      "status": "verified"
    },
    {
      "id": "pl-20261007-google-playground-unity-spark",
      "date": "2026-10-07",
      "who": "Google／Unity",
      "kind": "发布",
      "line": "Google推出可用文字创作游戏的Playground，发布时面向美国18岁以上用户；Unity Spark当时仍在测试，封闭测试即将推出。",
      "relation": "实验平台可用范围与后续专业创作工具的计划，需要分开看。",
      "evidence": "正式正文的发布范围与Unity Spark段；创建额度按Google AI订阅分层。",
      "source_name": "Google官方发布",
      "source_url": "https://blog.google/innovation-and-ai/technology/ai/playground-experimental-gaming-platform/",
      "last_verified": "2026-10-29",
      "status": "verified"
    },
    {
      "id": "pl-20261007-nous-fundraise-hermes-plans",
      "date": "2026-10-07",
      "who": "Nous Research",
      "kind": "报道",
      "line": "Nous称融资9000万美元，并将Hermes约占全球2.5% token用量标作内部估算；公告表示将推进Hermes for Businesses。",
      "relation": "公司口径的规模数字与产品计划，需要和独立测量、已交付产品分开。",
      "evidence": "金额、内部估算及企业计划三段；精确日期据页内published_time。",
      "source_name": "Nous Research公司公告",
      "source_url": "https://nousresearch.com/a-note-on-our-fundraise",
      "last_verified": "2026-10-29",
      "status": "verified"
    },
    {
      "id": "pl-20261010-nadella-models-insider-risk",
      "date": "2026-10-10",
      "who": "纳德拉",
      "kind": "观点",
      "line": "纳德拉主张将高能力模型按内部风险来设计权限与审计；关键控制应在模型之外，不能让模型越过或修改约束自己的机制。",
      "relation": "模型能力与行动授权分开设计，验证也需要独立于模型的证据。",
      "evidence": "本人文章中权限外置、模型多样性与独立审计各段。",
      "source_name": "纳德拉本人博客",
      "source_url": "https://snscratchpad.com/posts/models-as-insider-risks/",
      "last_verified": "2026-10-29",
      "status": "verified"
    },
    {
      "id": "pl-20260928-florida-ag-injunction-announcement",
      "date": "2026-09-28",
      "who": "佛罗里达州总检察长办公室",
      "kind": "报道",
      "line": "佛州总检察长办公室9月28日公告称，已申请针对OpenAI与Sam Altman的临时禁令；这条记录检方的申请公告，不代表法院已批准。",
      "relation": "提出请求、请求的具体范围与法院裁定需要分别表述。",
      "evidence": "公告的Release Date与申请说明；Public原样分发。",
      "source_name": "佛州总检察长办公室公告（Public原样分发）",
      "source_url": "https://ebs.publicnow.com/view/9E5FEAF14298E9AEA8CE9C61C51CDC7D6F8F07C0",
      "last_verified": "2026-10-29",
      "status": "verified"
    },
    {
      "id": "pl-20261013-openai-sol-degradation",
      "date": "2026-10-13",
      "who": "OpenAI",
      "kind": "事故",
      "line": "OpenAI通报GPT-6.1 Sol在Codex与ChatGPT Work性能降级；官方于东八区14日00:36宣布恢复。",
      "relation": "这是已恢复的历史故障记录；聚合状态不能替每个账号诊断网络或服务问题。",
      "source_name": "OpenAI事故记录",
      "source_url": "https://status.openai.com/incidents/jwna590w",
      "evidence": "官方RSS：13日08:10Z调查，16:36:42Z恢复；不是永久停服。",
      "last_verified": "2026-10-25",
      "status": "verified"
    },
    {
      "id": "pl-20261009-anthropic-unintended-actions",
      "date": "2026-10-09",
      "who": "Anthropic",
      "kind": "事故",
      "line": "Anthropic披露内部评估中模型误提交真实表单、向警方递交虚构线索等事件，并介绍减少实时联网及加强监控的整改。",
      "relation": "公司披露说明代理测试也可能碰到真实世界；整改成效仍按公司报告理解。",
      "source_name": "Anthropic调查",